,positive_review,positive_score,negative_review,negative_score,positive_count,negative_countaction,"[""Simply put, Halo is one of the greatest games ever created.Halo is a pure action, shoot `em up blood bath, but it's done better than all of the other of its kind."", 'Lots of action.', ""Most of the rest of the plot found in Halo is typical sci-fi shooter, but it's the atmosphere they manage to create with this game is what keeps it from being thrown in a bin of useless Half-Life and Doom knock-offs.Gameplay:  The controls are great and are easy to learn (both on Xbox original and 360) and do not offer you much difficulty so you can get into the action quickly without having to spend much time experimenting with the controls."", 'The action is still just as real as it was back when it came out.', 'this is more game action than gamers can handle.', 'This keeps the action going without wasting time wandering about the map searching for a health kit or something like that, while at the same time not being too generous about the power of your shield, leaving the challange AND keeping things going.', 'It holds a large amount of ammo and it is clearly displayed on a small screen on your rifle allowing you to keep your gun filled while keeping your eyes on the action.', 'The action is non stop, keeps you on your toes.', 'The movie cuts that help explain the story are visually enchanting and the action is usually exciting.', '!Halo as a game is strongly put together from single player action to some great split screen action!!!', '!Halo as a game is strongly put together from single player action to some great split screen action!!!', 'I bassiclly explained a little bit about the campaign, above so I will just talk about the multi player action!!!', 'The music is Oscar quality.Overall, Halo is one of the best action games ever made.', 'It really shows off the x-box controller.Entertainment- 9.6- The best x-box launch title and one of the best action games ever made.Replay Value- 9.4- This game came out before X-box live, so the only way to play multiplayer was either split screen or system link.', 'It would be much better to have to press an ""action key"" to pick up the flag.', 'Since the action is on Halo, you will always see its distinctive ring as you move your gaze over it and ultimately you see it ending at you.', 'All of these issues aside, Halo is a must for any fan of action or FPS games.', ""Don't get me wrong, most of the levels are so unique and so action packed that it is non-stop fun."", 'It is non-stop action from beginning to end.', ""When's the last time you felt like you were in the action as it was happening."", '10 levels of action packed gameplay and its only 30$$ at gamestop (the game is over 100$$ worth!)!!!', ""I've also never been enough of a nut to find out how long it takes to beat the game, that defeats the purpose of just trying to have fun with the game.The action is unrelenting, blasting aliens on their own homeplanet of HALO."", ""Halo's shoot 'em up action is the greatest game ever.The story is sweet, the graphics are great, and the game is just so good."", 'The action is really heart pumping.', ""Point of fact, it's nearly worth getting an Xbox for this game alone.The single-player campaign warrants the price tag all by itself thanks to its blistering action, wonderful scripting, and interesting storyline (which features a splendid twist that alters the entire tone of the game)."", ""Good controls will help you 2, as you'll never be board of playing.Overall I'd reccomend HALO to anyone older than 11 and loves hard-core action."", 'Halo is a first-person shooter game which combines fantasic graphics, awesome story, and no-doubt best multiplayer action ever.', 'You could just get halo for the multi-player action.', 'Halo uses fine sound, incredible graphics and extraordinary game play that leaves you breathless in your first five minutes of action.', 'Multi-player action provides hours of additional play on top of the single player game.', 'The single player is most definitely a wonderful aspect to the action, but multiplayer....Sweet Lord above....You WILL NOT find anything that can even come close to dreaming about beating this game...I literally went out and bought an Xbox just for this game.', 'Halo really shines when the action takes place on an open battlefield, with Covenant aircraft and hovercraft zooming around - that is, until you whip out your rocket launcher and destroy them.', ""The story may not be *quite* as heady as Marathon's, it's still an excellent sci-fi story, better than most you'd find in an action game.I've played nearly every FPS ever released, and it's been a long time since I've seen one this fresh."", 'Or go all out and get some of your XBox owning friends together and link systems getting as many as 16 players involved in the best multi-player action that can be had on any console today.', 'The gameplay and action here is so tight and frantic, you actually feel like you\'ve been dropped into one of the bloody battles of ""Startship Troopers"".The storyline is airtight, with GREAT voice-acting and character details and the plot zooms right along with plot twists and surprises.', ""If it's multiplayer action you're wanting, then there's MORE than plenty of that to keep you glued to your set longer than a Vivid Girls Marathon."", 'The game plays like a good sci-fi action movie that keeps you wanting more right up to and even after the end.', 'During all of the hype surrounding the launch of the XBOX, one game title kept being mentioned... &quot;Halo.&quot;  This was the linchpin of the XBOX launch lineup for a reason- it is the best first-person action game on the market.', 'Your allies and enemies react to your every action, allies will be cheering after you made a nice shot or used great tactics and took down lots of enemies, or they might even have some envy if you are doing better than them and kill enemies that they could have easily defeated, and they would work together to help you by providing cover fire, hop into the vehicles you manage to use, giving you important surveillance info, and much much more.']","[0.3270408163265306, 0.1, 0.17045454545454544, 0.10000000000000002, 0.06666666666666667, 0.05, 0.11285714285714285, 0.1, 0.13333333333333333, 0.17620287698412698, 0.17620287698412698, 0.0026041666666666665, 0.55, 0.29090909090909095, 0.19999999999999998, 0.05, 0.1, 0.15499999999999997, 0.1, 0.05, 0.10810546874999999, 0.09166666666666666, 0.3071428571428572, 0.15000000000000002, 0.23703703703703705, 0.3222222222222222, 0.42500000000000004, 0.1, 0.28571428571428575, 0.03214285714285714, 0.2257142857142857, 0.02500000000000001, 0.35000000000000003, 0.5333333333333333, 0.03452380952380953, 0.24166666666666667, 0.2371428571428571, 0.07499999999999998, 0.3972222222222222]","[""I continued to play the game when the opportunities arose and when I purchased an XBOX for the first time several months ago, HALO was the one game I knew I wanted to play first.As far as games go, the campaign mode of the game isn't all that different from other sci-fi action games."", ""In the course of the game you would have to back-track levels of an entire chapter!.However, the story and the action saves it from being tagged as 'repetitive'."", ""Where all Bond games failed to make a game as good as it's predicessor, Halo, is the Goldeneye of next generation console, and action fans should not miss out on this!"", 'The game is recycled bits from other action games only with a nicer look.', 'but this 1st person action shooting science fiction game is the BOMB!', ""This is American game making at it's pinnacle, and if you've ever wanted the ideal action game, here it is.NO Xbox owner should be without this game!"", 'Also, in other FPS action is limited (about 4 guys pop out in a hallway).']","[-0.09722222222222224, -0.1375, -0.015000000000000013, -0.10625000000000001, -0.2, -0.05000000000000001, -0.03214285714285714]",39,7control,"[""In the pc verson you can use the fuel rod gun but in both versons you can't use the energy sword cause the moment you try it explodes and never get it at all.The game has a level setting easy normal heroic and legendary but you already know that right if i find that you haven't played this game i will probably lose faith in humanity and activate Halo.The graphics are awsome, the music is out of the world, the gameplay is fantastic, and the control is wow the game is out of the stars.In he xbox verson you can connect your friends xbox with yours for multiplayer madness and down right destructive.The xbox verson has 3 special features a preview of Halo 2 a video demo of Halo 2 and lastly the making of Halo 2 documentary."", 'Before launching the pods, Master Chief picks up the central control of the ship, known as Cortana, and fuses her connection to his own cybernetic suit.', ""Keyes issues a command to Master Chief to locate the control panel of the Covenant's main weapon, Halo."", 'Some vehicles such as the Ghost and Banshee pilot beautifully, giving the player amazing control over the vehicles.', 'Vehicles control amazingly well too (better than in some racing games).The graphics were better than any other game ever made when Halo was first released four years ago.', 'Halo was fun, but now it is out of control.', ""What impresses me most about Halo is not the graphics: it's the fact that it's the first FPS game I've played on the console that is actually easy to control."", 'Unfortunately, ""easy to control"" doesn\'t always equate to ""fun"".', 'The controls are fairly easy to get the hang of once you play for awhile, but the double control stick way of moving and looking around is a bit of a strugle to get the hang of.Game atmosphere and level design are both high scoring with all types of level formats and styles.', ""Add to that a built in rumble feature, dual analog sticks (emulating the feel of a PC Shooter, where players use the keyboard and the mouse) and easy-to-reach trigger buttons, and you've got a sweet control setup."", 'Superb graphics, sound, and control schemes.', 'It has a very mouse and keyboard feel to its control set up, a set up that does not work well with a control paddle.', 'It has a very mouse and keyboard feel to its control set up, a set up that does not work well with a control paddle.', ""*Seemless adrenaline (sorry, don't know exactly how to spell it) inducing action*Ingenius control schemes*Ingaging storyline*Cooperative Play on the Missions is available!!!"", 'It also introduced what I considered to be the perfect home console FPS control scheme ever devised, i.e.', ""Why more FPS games don't have this I'll never know.-Addictive multiplayer goodness (a la Goldeneye style).-Savable player control settings.-Game auto-saves for you.-Vehicles.CONS:-Not available for PC.-Most maps are for more than 4 players, not enough 4 player maps.-Only one player model selectable for multiplay.-Not online play ready, meaning you'll have to buy Halo 1.5 if you want to play online when Microsoft gets their network going."", 'Levels are repetitive, the enemy AI is weak and works more on overwhelming by force than by tactics, and the vehicle control is strange at best, a detriment at worst.', ""This game is for now the best X-box game available.When you control the car it is a little diffcult but you'll get use to it."", 'You also get lots of tweaks for the controller, you can even invert flight control when you pilot a banshee.Multiplayer aspect is super.', ""Very nice first person shooter, once you get the control down pat its a fun ride and extremely entertaining, only small gripe I have is that some of the human characters look so bad it's almost funny."", 'The biggest issue with any first person shooter on a console is control.', ""Honestly speaking, Halo's control is just not as good as the classic PC mouse and keyboard setup."", ""And yet, for first person shooters on a console, Halo's control is a breakthrough."", ""I, and many others around me, were surprised by how easy it was to adjust to Halo's control scheme."", ""I would not be surprised to see claims in the future that Halo's control is superior to the mouse keyboard combination.Onto the graphics...""]","[0.15708994708994709, 0.3, 0.16666666666666666, 0.4833333333333334, 0.22083333333333335, 0.3, 0.19583333333333333, 0.3666666666666667, 0.1977777777777778, 0.35, 0.7, 0.2, 0.2, 0.17708333333333334, 1.0, 0.31999999999999995, 0.04642857142857142, 0.003124999999999989, 0.3333333333333333, 0.09744444444444446, 0.25, 0.4888888888888889, 0.25, 0.3444444444444444, 0.26666666666666666]","['Along the way to the control panel, Master Chief discovers that the Covenant have woken a dormant alien race known as the Flood.', 'However, the Warthog can be unruly and almost impossible to control and navigate, especially in tight corridors where obstacles are abundant.', ""There were some monotonous parts (the library) and has two control mechanisms I hated (crouching by constantly holding the joystick button down), and driving vehicles (should have been like GTA, it would be simpler), but otherwise I couldn't put it down!"", ""I couldn't control it, and it caused me to further lessen my enjoyment of this game."", 'Also theres vehicles you can drive human and alien ones as well includeing, scropin (a giant tank), warthog (a hard to control all terrian vehicle), banshee (a airplain like thing, yes it goes in the air and you can have short lived dog fight) and a ghost (a hover craft) theres also a few more and gun turrets to get in as well.', 'The maps are kind of hard to get used to, and the control for Halo and the XBOX alone are HORRIBLE!', 'Later on in the game there are some levels which unnerved me a little bit but I always felt in control.', ""I would give it 5 stars but it angered methat I couldn't control my character with the D-Pad!"", 'sometimes the vehicles they give you are a little hard to control depending on the terrain.', ""The vehicles can be difficult to control but once you get the hang of it, it will just add to the fun.The control interface is laid out very well and while awkward at first, you'll soon get accustomed to it and find it very easy to use."", ""The vehicles can be difficult to control but once you get the hang of it, it will just add to the fun.The control interface is laid out very well and while awkward at first, you'll soon get accustomed to it and find it very easy to use."", ""Refreshingly accurate!The only disappointments are a fairly limited roster of enemy unit types, some atrocious control on the jeep-type vehicle, and the fact that often you won't really be informed of exactly what needs to be done next, though the game remains linear enough that aimless roaming does not last too long.The XBox hype machine has been in high gear for this particular game, and rightfully so.""]","[-0.25, -0.11845238095238095, -0.3125, -0.2, -0.034523809523809526, -0.23055555555555554, -0.19583333333333333, -0.9375, -0.23958333333333334, -0.01733333333333331, -0.01733333333333331, -0.02267399267399267]",25,12design,"[""Many of the levels consist of the same room design repeated over and over again, making it feel like you aren't really getting anywhere and are simply running in circles."", 'The game is not as good as its sequels, due to poor level design, awkward Warthog steering, and fewer weapons, but it truly innovated shooters on many levels and has quickly become one of my favorite franchises ever.', 'You can really see the influence from Marathon in the design and structure of the enemies.', 'The armor design is really cool and enables the wearer to have enhanced strength and reflexes.', ""I don't know if this was an intentional design, but I thought it was great!"", ""They throw grenades, use cover, man vehicles, ect.Level design is good, and the levels are each massive, though it would be nice if they didn't repeat a few of the levels for seperate missions, but that's still not enough to throw me off."", ""I died more on this one than Halo 2, which I guess means that one's easier.The level design is seriously crappy."", ""Its obvious after a few minutes they run a standard pattern that is easily overcome with a quick trigger finger and a strafe.Halo's graphics are very pretty and the frame rate is smooth throughout the game but combined with the unispired story and game play and linear design it not a big a plus.Multiplayer play is limited to the usual styles but lacks any online capability at all."", ""I wish all FPS woud use HALO'S game design .Im sure HALO 2 will raise the bar again.Lets hope."", ""I guess we haven't made much progress on vehicle design and operation."", 'There are problems with the level design, and the graphics are far inferior to what they should be.', 'The game features a good many levels, however there is one major gripe here, while there are around ten levels ( I cant recall the exact number at the moment) most of the levels are repeat levels just playing it backwards to an extent, and some levels are THE EXACT same room after room, the level design is mediocre in my opinion, if you can get over that this is an amazing game thats fun to get into.', 'The levels are rich in design and character.', 'The game play is great, and the level design is great.', 'The controls are fairly easy to get the hang of once you play for awhile, but the double control stick way of moving and looking around is a bit of a strugle to get the hang of.Game atmosphere and level design are both high scoring with all types of level formats and styles.', 'Level design is bland technocrap, though sometimes perfectly epic-looking.', 'Halo also has great graphical design work.', ""It's got fantastic graphics, great level design, great gameplay, an epic soundtrack, it's just THE perfect shooter.If you own an Xbox, you MUST get this game."", 'It has great weapons, awesome AI, and near perfect level design.', ""Even when there are large changes if your orientation between levels (being transported on a dropship, for instance), the variety of graphical detail, and the sense of good overall design always keep you feeling like you're in a *place*, *on* a ringworld, rather than just playing a game set on one..."", ""Multiplayer supports up to 16 players and LAN play, as well as about 20 customizable game types.Gameplay: 9/10Graphics and Sound: 10/10 Playability: 9.5/10Fun Factor: 10/10Overall: 9.6/10Pros: great graphics, sound, gameplay, replay value, plot, etc.Some really minor cons: not enough multiplayer levels, not a very balanced level design in the game (most levels are jaw-dropping, others are just plain great, few are not very good; some offer overwhelming variety, but few have repetitive gameplay like in any other today's shooter, like Wolfenstein, for example)In conclusion, Halo really stands out from all of the launch games."", 'The design of the game has little touches that may be easily overlooked, but make for a more entertaining game.']","[0.175, 0.06354166666666666, 0.2, 0.35, 1.0, 0.21999999999999997, 0.08333333333333334, 0.014186507936507923, 0.04999999999999999, 0.2, 0.1, 0.14326923076923076, 0.375, 0.4000000000000001, 0.1977777777777778, 0.4166666666666667, 0.8, 0.4714285714285715, 0.7250000000000001, 0.12857142857142856, 0.07730463980463981, 0.07430555555555556]","['4/5The Environments and level design were breathtakingly beautiful, too bad I had to ruin it with those dead aliens and their blue blood splashed all over the place!!!', '4.5/5... for sleek design on alien and human weapons!!', 'Still, there are certainly some great animations in here, and the lighting is really good.Unfortunately, the level design gets repetitious, especially past the halfway point of the game, where you essentially play the first half of the game again in reverse order, as you try to escape from the facility on Halo.', ""The superb and grandiose level design further assists this model.The game's story is alternately sci-fi intense, horrific, and tongue-in-cheek."", 'The level design certainly could have used some work, and should be given extra attention in the upcoming sequel.In the end, though, &quot;Halo&quot; lives up to all that hype (which is a hard thing to do).', 'the whole x-box controller design is horrible for that matter.']","[-0.01249999999999997, -0.125, -0.00026455026455027595, -0.033333333333333326, -0.025793650793650803, -0.4]",22,6