,positive_review,positive_score,negative_review,negative_score,positive_count,negative_countstoryline,"['A classic to be sure, the storyline and graphics were ground-breaking for the time period, and it is nice to revist the classics such as this on a familiar console that we all know and love.', 'While I prefer Halo 2 in terms of gameplay and overall storyline, Halo is in itself a perfect game for any gamer.', 'If you want to follow the complete Halo storyline then you should start with Combat Evolved, but if you want to simply get the feel for Halo for the first time, I say skip Combat Evolved and start with Halo 2.', 'the storyline is great and the game play is awesome.', ""The storyline is fantastic, and Master Cheif is one of the greatest game characters I've encountered.Try It."", 'The storyline here in this game is really good, makes sense, doesnt make you lost keeps things on track.', 'The storyline is interesting, and the game is very well-designed overall.', ""Once again, even if you have Halo 2, it's worth your time to go play Halo 1 and learn where the storyline is coming from."", 'The plotline in GoldenEye was so much better, and the guns were better.The storyline is that you are a magical thing that is a captain of a spaceship and you are sent down to kill aliens.', ""GoldenEye has a better storyline and better levels, sad that GoldenEye came out in the late 90's and Halo came out for X-Box.But, it is fun, thats why it has 5 stars."", 'Halo had the best in-game storyline ive ever seen.', ""You might say that you've seen better gameplay and storyline."", 'Especially when you beat the game on Legendary, it shows an confusing clip that makes you question the storyline.', 'graphics, and sound are top notch, but the weapons, gameplay, and storyline are nothing too interesting.', 'The game is perfect in every way that I could think possible it has a great plot and storyline, great characters, awsome weapons and vehicles, good villians and allies, everything about it is beautiful.', ""Point of fact, it's nearly worth getting an Xbox for this game alone.The single-player campaign warrants the price tag all by itself thanks to its blistering action, wonderful scripting, and interesting storyline (which features a splendid twist that alters the entire tone of the game)."", ""It has a superb storyline, graphics that haven't yet been riveled by any system, and unseen realism."", 'The graphics, music, sound effects, replayability, and controls are all top notch and the storyline is involving and immersive.', 'And it gets crazier when more factions enter the storyline and you have 4-way battles going on.', 'The gameplay and action here is so tight and frantic, you actually feel like you\'ve been dropped into one of the bloody battles of ""Startship Troopers"".The storyline is airtight, with GREAT voice-acting and character details and the plot zooms right along with plot twists and surprises.', 'From the storyline to the gameplay to the novel use of exotic vehicles for completing missions, this game is truly awesome.', 'with a third person shooting mode, great storyline, great arsenal of weapons, great places to wreak havoc: in the air, on the ground, or just on foot,good god this even has a good soundtrack to go with it.']","[0.35694444444444445, 0.19999999999999998, 0.11666666666666665, 0.4666666666666666, 0.3333333333333333, 0.14999999999999997, 0.075, 0.3, 0.2814814814814815, 0.1, 1.0, 0.5, 0.075, 0.4666666666666666, 0.5357142857142858, 0.23703703703703705, 1.0, 0.45, 0.5, 0.03452380952380953, 0.3666666666666667, 0.6200000000000001]","['I am not just saying this because you shoot aliens, but a simple alien storyline gets pretty boring after a while.', ""This game has a great storyline, and I have enjoyed the character development as well as gameplay, but the thing that kept me from giving this game 5 stars was the controls.My biggest pet peeve is a game with controls so complicated that you spend more time learning the controls than you do defeating the game.That said, this game isn't quite that bad."", 'Everything just seems to have its proper place in the game, and that really helps in drawing you into the admittedly well-crafted Starship Troopers-esque storyline.', 'The storyline is derivative and that makes me tune out and care less.']","[-0.25, -0.1111111111111111, -0.06666666666666667, -0.16666666666666666]",22,4years,"[""A great nostalgic addition to your collection if you haven't played the original Halo since it came out, actually I bought it about 4-5 years later but it's a great game none the less."", 'Graphically, it cannot compare to Halo 3, which in itself cannot compare as well to games released this year (Halo 3 is, of course, already 3 years old).', ""But Halo's topnotch story, voice acting and script leaves the original, almost 10 years old, as one of the best games of all time."", ""Yeah..I know I'm almost 8 years late playing this famous game, but at the time of the XBOX/Halo launch, I was JUST getting my original Playstation and owning an XBOX was not even a consideration back then."", ""Now I see what the hype was all of these years in regards to Halo and I'm glad I am finally partaking."", ""I favored the maps that held vehicles (Sidewinder, Blood Gulch).The story mode was and still is great to play, though since I have beaten it numerous times in the past years it's not as exciting, mainly because I know what to expect now."", 'The human race has already gotten quite far with technological advancements, but the Covenant is still light years ahead of us!', 'Nothing better than playing a game after many years to see if it got rotten like an egg or aged like a fine wine.', 'I just got this game a week ago and have been playing it as much as I can ever since.It\'s graphics are great,the story is great,the gameplay is great,split screen is great.Now I haven\'t played it online(Don\'t got DSL or Broadband)so I can\'t talk about it.And don\'t think for one moment that just because it\'s a few years old it isn\'t any good,cause it\'s still one of the best and will probably be 2,3 decades from now.I\'ve played the PS2 for a long time,I just got my X-Box last christmas(had a PS2 since MOH Frontline),and have played many Fps\'s and ""Halo Killers"" on it,and the most I\'ve seen is a few games that MIGHT be AS good as Halo,I have seen none better(I\'m not including Halo 2 or 3,because I haven\'t played them).If you are looking for a hardcore FPS this is it,if you are looking for an all around fun game this is it,if you are looking for a great game to play with friends this is it.What all this review is trying to tell you is that this game is worth every penny,nickel and dime you spend on it,period.Buy this game,if you don\'t like it you can sell it and get something else,but you most likely won\'t be selling it.', 'The graphics are ok but that is in 2007 6 years ago these graphics were amazing.', 'Nearly seven years after the birth of the X-Box I found myself in line at a local video game retailer buying a used box for a fraction of the original cost when it was released.', 'Over the years, cinema has become my new favorite hobby, but occasionally I crave for that ability to blow something up (the perfect de-stressor to the corporate world).', '""Halo"" pulled some cheap shots, and now, six years later ... it feels dated.Grade: **1/2 out of *****', 'Vehicles control amazingly well too (better than in some racing games).The graphics were better than any other game ever made when Halo was first released four years ago.', ""Halo is a science fiction based game.It is also a First Person Shooter.Arguably the best shooter to date.Halo takes place in a futuristic imaginative world.With aliens bent on filling out a prophecy.You play as a cyborg/human who is the last of his kind.Created by years of work and research.You fight the aliens (the covenent) gun to gun in this epic other wordly game.You guide marines in battle and go over many landscapes.From beaches to mountainous snowy horizons.You crash land on an ancient planet.With an mechanical touch.It's name is Halo and it's shaped like a ring.Hordes of aliens out number you,but you have many options on how to approach this.You can creep about and take them down one by one or gun them all down and toss a few grenades to sweeten the deal.This game has builtin co-op wich is the prime meat of this game in my opinion.Co-op lets you replay the story the same exact way but 2 cyborgs now take on such a challenge.You and a friend can easily overcome the on comming frauth easily with teamwork.Change the diffaculty and let your enemies now have a bigger one-up on you.They are now smarter and stronger,and they actually use these new abilities.The multiplayer plays out like any other FPS,gun down friends or catch a flag.Heres the catch you can make your own game type awsome.The vehicles are stunning and crafty from the tanks to the gohst(a futuristic enemy craft).The weapon variety is fantastic.Handguns are nice with an optical zoom for tactical operations.Snipers and AR rifles are in here with nice new touches.The alien weapondry is vast and advanced and lower shields easily.Fight a parasitic creature the covenent fear and find the truth of Halos purpose at the depths of Halo center.Work along side your fellow marines to the very end and last but not least make it out alive."", 'halo is the greatest first person ever created.the graphics at the time were stunning and even now 3 years later they look great.halo is one of the few fps that has an involving story.and another strong point for halo is the master chief hes cool.im a halo fan but the only complaint i have is the diffuculty its a bit easy if you have an xbox and you were stupid enough not to buy BUY IT NOW WHAT ARE YOU WAITING FOR HALO IS WAITING', ""This game is still great and even a few years after i beat i still have fun playing it and campaign is still great ,this game just never gets old.Any true xbox fan knows how amazing this game is and even if you don have xbox its worth buying just for this.This is beter than any other popular games for other consols such as gta's,zelda,marios, half life 2 and all the others.What else can i say besides this is the game responsible for me buying my xbox in the first place and realizing what i was missing out on for so long .ITS JUST ONE OF THE BEST GAMES TO COME OUT IN A LONG LONG TIME.Buy it if u didnt already!!"", '!Most people, who own a xbox must have heard of Halo by now since it has been on the market for about 5 years, still one of the best games around too!!!', ""I've heard for years how great this game is so I finally bought it on sale for $15, even that was too much.I am a veteran PC player of first person shooters who started with the original Wolfenstein 3D and have played almost everything since including all the Dooms, Quakes, Jedi Knight, Half-life and Unreal Tournament."", ""The graphics may have been great a few years ago when the Xbox launched, but today, I don't see any level of detail that can't be found in other games."", 'The controls are very intuitive and the graphics still hold up remarkably well today, now two or three years after the game first came out.', ""After owning this game for 2 years legendary is easy now I'm experienced."", ""This is where replay value comes in because you'll want to complete all 10 levels on different difficulties and when you're on level select it shows symbols of which difficulties you've done it on.The first thing you'll notice are great graphics but not as good as the new Ninja Gaidan but this game was made 2 -3 years ago(check out HALO 2 screen shots on Gamespot)."", ""I bought my own Xbox some weeks ago and I couldn't wait to play this game Halo of which everyone was talking about so much for years... My expectations were at the top, and the game had to be a real masterpiece to fill my expectations."", ""I still get as much enjoyment out of it today as I did four years ago, and I suspect I'll update this review again in another four years with the same opinion.One of the best FPS to ever grace any console."", ""I still get as much enjoyment out of it today as I did four years ago, and I suspect I'll update this review again in another four years with the same opinion.One of the best FPS to ever grace any console."", ""Before I bought Halo, I couldn't see what the big fuss is about, but now I do - Halo is the Real Deal, a true Classic that you will play endlessly and fondly remember years from now."", ""There aren't any bots to speak of, networked play has been around for years either on the PC or Playstation 2, there are few weapons to really speak of, enemy variety is also hurting, and the AI is fantastic but merely represents one of the best around, not a higher echelon in enemy intelligence."", 'I have been playing video games for about 10 years now, and halo is the best example of an all around game that i have seen to date.', 'Halo is that game and it has affected me in an amazing way.Halo has been in development for years, and it shows.', ""Half-Life has stood as the king of first person shooters for years (and for good reason) but I honestly think this is the first game to give it a true run for it's money (if only it was made available on PC)."", ""I've been playing for more than 20 years, from Coleco, Atari, and PC, to Nintendo, PS, PS2, and Xbox... and if I have to choose the best all-around game, it must be Halo.I just finished in cooperative mode and my friend and I were delighted of how real it looks, how the AI respond and how the atmosphere feels.I played it on a 53&quot; Sony and a Kenwood/JBL Dolby Digital home theater and not even Half-Life felt like it.If you have an xbox and don't have Halo, you're just wasting your money.""]","[0.1135416666666667, 0.1, 0.36875, 0.034999999999999996, 0.25, 0.3027777777777778, 0.19999999999999998, 0.18333333333333335, 0.15, 0.55, 0.01874999999999999, 0.32727272727272727, 0.2, 0.22083333333333335, 0.14926289926289932, 0.11969696969696972, 0.1132699275362319, 0.7000000000000001, 0.1708333333333333, 0.15833333333333335, 0.19999999999999998, 0.4583333333333333, 0.22662337662337664, 0.11666666666666665, 0.39999999999999997, 0.39999999999999997, 0.11833333333333333, 0.12916666666666668, 0.3, 0.10000000000000003, 0.26875, 0.3142857142857142]","[""I've played all the Halo games including Halo, Halo 2, Halo 3, Halo Reach, Halo ODST, and Halo Wars.In my opinion, I would rank the games from best to worst as Halo, Halo Reach, Halo 3, Halo 2, Halo ODST, then Halo Wars.I've played through the game at least a dozen times over the years."", 'I mean, after all, the game I am about to review is 9 years old and was one of the original Xbox launch titles.', ""In a few years, you'll look back on this review after you've bought this game, and thank me."", ""Much like the N64's Goldeneye and the PC's Half-Life and Rainbow Six, Halo is one of those yardstick first-person shooters that people will be comparing games to for years to come.That's not to say the game is without its faults."", ""It's so much fun that even years later we still want to play this game from time to time!"", 'The game is 7 years old now.', 'I bought this game over four years ago and just have to say I must of replayed this game at least a dozen times (Start-Finish).', 'hmm i waited a couple of years after this was released to pick it up on pc, and i was not impressed.', 'This game has been out for a few years now and it looks like the first game with the ability to top this game will be Halo 2... we shall see.', ""Edit November 15th, 2008:Over four years later, and this game hasn't aged a day.""]","[-0.30000000000000004, -0.05937500000000001, -0.20000000000000004, -0.1, -0.06666666666666667, -0.15000000000000002, -0.3666666666666667, -0.5, -0.10833333333333335, -0.16666666666666666]",32,10series,"['I replay the whole series all the time.', 'I bought a copy so that I could have a complete A-Z collection of the series.', 'halo combat evolved is the best 1st person shooter period halo 1 is the best game in the series and in my opinion has the best campaign mode buy this game', 'We picked up ""Halo: Combat Evolved"" right after we got our XBox 360 because my son wanted to start at the beginning of the Halo series.', 'This is a fairly fun shooter that has spawned at least five additional games and even a fairly well written series of books (Halo, Books 1-3 (The Flood; First Strike; The Fall of Reach), which were actually fairly good and follow this game\'s plot line closely).You are controlling ""The Master Chief"", a heavily armored and physically augmented ""Spartan"" super soldier.', 'Having beat that, I decided to try out the original on my Xbox and, needless to say, can say that this series is worth the hype.', 'However, never owning an original Xbox, instead having both a PlayStation 2 and a GameCube, I figured it would be best to start off with the first game of the series.', ""I don't care how much Bungie spits and polishes this series or how many weapons and power-ups they add it still won't change that they've turned the series into a Rambo style shooter and there are HUNDREDS of games like that already on the market.If they ever make another Halo game they need to go back to the basics and really see why the first game is still the most popular entry in the series."", ""I don't care how much Bungie spits and polishes this series or how many weapons and power-ups they add it still won't change that they've turned the series into a Rambo style shooter and there are HUNDREDS of games like that already on the market.If they ever make another Halo game they need to go back to the basics and really see why the first game is still the most popular entry in the series."", ""I don't care how much Bungie spits and polishes this series or how many weapons and power-ups they add it still won't change that they've turned the series into a Rambo style shooter and there are HUNDREDS of games like that already on the market.If they ever make another Halo game they need to go back to the basics and really see why the first game is still the most popular entry in the series."", '""Halo"", for me, needs to get better for me to enjoy the entire series.', 'This game is the latest in a series of universe-changing (and unbelievably addictive) first person shooters.First, there was Wolfenstein.', ""And if you've ever played Bungie's previous series Marathon, you'll quickly notice a million tiny connections."", ""For those of you that followed Bungie's Marathon games (on the Macintosh), you will see many nods to that series within this game.""]","[0.2, 0.1, 0.44000000000000006, 0.2857142857142857, 0.1537037037037037, 0.05833333333333333, 0.30625, 0.1611111111111111, 0.1611111111111111, 0.1611111111111111, 0.3, 0.0875, 0.05555555555555555, 0.04999999999999999]","['This game got a game of the year award.The game follows the same with sonic the hedgehog series for an example when the first sonic was made sega was experimenting with it to make a sequel that better than the first.Halo follows the same but the game is awsome.', 'When Halo 3 came out, it made me want to go back to the start of the series, so I began playing this game then.', ""This means that, barring a series of sudden attacks, Master Chief will always survive (this is a difficult adjustment for someone new to the multi-player...there's no slow sniping, it's either one-shot one-kill or nothing)."", 'Aside from ESPN\'s football series and a few other miscellaneous titles, I don\'t even use my Xbox much because I spend my ""game time"" on my PC.', 'They appear from air ducts, nearby rooms, from alien camps, or even landing alien spacecraft.If you like the Quake series on the PC, Goldeneye 007 on the N64, or Syphon Filter series on the PS1, then you will love this game.', 'They appear from air ducts, nearby rooms, from alien camps, or even landing alien spacecraft.If you like the Quake series on the PC, Goldeneye 007 on the N64, or Syphon Filter series on the PS1, then you will love this game.']","[-0.10625000000000002, -0.2, -0.053409090909090906, -0.13125, -0.1, -0.1]",14,6